<?xml version="1.0" encoding="utf-8"?>
<!DOCTYPE corpus SYSTEM 'puns.dtd'>
<corpus lang="en" id="subtask1-heterographic">
  <text id="t_1">
    <word id="t_1_0">When</word>
    <word id="t_1_1">the</word>
    <word id="t_1_2">church</word>
    <word id="t_1_3">bought</word>
    <word id="t_1_4">gas</word>
    <word id="t_1_5">for</word>
    <word id="t_1_6">their</word>
    <word id="t_1_7">annual</word>
    <word id="t_1_8">barbecue</word>
    <word id="t_1_9">,</word>
    <word id="t_1_10">proceeds</word>
    <word id="t_1_11">went</word>
    <word id="t_1_12">from</word>
    <word id="t_1_13">the</word>
    <word id="t_1_14">sacred</word>
    <word id="t_1_15">to</word>
    <word id="t_1_16">the</word>
    <word id="t_1_17">propane</word>
    <word id="t_1_18">.</word>
  </text>
  <text id="t_2">
    <word id="t_2_0">This</word>
    <word id="t_2_1">sentence</word>
    <word id="t_2_2">contains</word>
    <word id="t_2_3">no</word>
    <word id="t_2_4">pun</word>
    <word id="t_2_5">.</word>
  </text>
  <text id="t_3">
    <word id="t_3_0">"</word>
    <word id="t_3_1">I</word>
    <word id="t_3_2">ate</word>
    <word id="t_3_3">no</word>
    <word id="t_3_4">soap</word>
    <word id="t_3_5">,</word>
    <word id="t_3_6">"</word>
    <word id="t_3_7">Tom</word>
    <word id="t_3_8">lied</word>
    <word id="t_3_9">.</word>
  </text>
</corpus>
